iPhone 14,Rojo espacial,56,256,1100,Sistema avanzado de dos cámaras Gran angular de 12 MP | Ultra gran angular,A15 Bonic,Lightning,6.1" Super Retina XDR,Hasta 20 horas de reproducción de video,Frente de Ceramic Shield | Resistente al agua | 30 minutos - 6 metros | Aluminio de calidad aeroespacial,Face ID,7.8,146.7,172,71.5
iPhone 12 Pro Max,Negro Caballo,34,512,1300,Sistema de cámaras Pro Gran angular de 12 MP | Ultra gran angular | Teleobjetivo,Chip A14 Bionic,Lightning,6.7" Pantalla Super Retina XDR,Hasta 20 horas de reproducción de video,Frente de Ceramic Shield | Resistente al agua | 30 minutos - 6 metros | Acero inoxidable de calidad quirurgica,Face ID,7.4,160.8,228,78.1
iPhone 11,Azul neptuno,76,1024,5000,Sistema de dos cámaras Gran angular de 12 MP | Ultra gran angular,Chip A13 Bionic,Lightning,6.1" Pantalla Liquid Retina HD,Hasta 17 horas de reproducción de video,Delantera y posterior de vidrio | Resistente al agua | 30 minutos - 2 metros | Aluminio de calidad aeroespacial,Face ID,8.3,150.9,194,75.7
iPad Air,Amarillo moco,21,256,300,Cámara gran angular de 12 MP,Chip M1,Compatible con Apple Pencil (2da G) | Magic Keyboard | Smart Keyboard,Conector USB-C,10.9" Pantalla Liquid Retina,Hasta 10 horas para navegar por Internet a través de Wi-Fi o ver videos,Touch ID,6.1,247.6,461,178.5
iPad mini,Blanco alone,22,512,800,Cámara gran angular de 12 MP,Chip A15 Bionic,Compatible con Apple Pencil (2da G) y Teclados Bluetooth,Conector USB-C,8.3" Pantalla Liquid Retina,Hasta 10 horas para navegar por Internet a través de Wi-Fi o ver videos,Touch ID,6.3,195.4,293,134.8
Mac mini,Rojo red,90,1024,63,3000,No aplica,Chip M1 de Apple,8 núcleos,Admite un monitor hasta 6K y un monitor hasta 4K,No aplica,8 núcleos,No aplica,Dos puertos Thunderbolt/USB 4,No aplica,19.7,3.6,1.2,19.7
iMac,Negro fuerte,45,650,64,3500,Cámara FaceTime HD de 1080p,Intel Core i9,10 núcleos,Pantalla Retina 5K 27",No Aplica,AMD Radeon Pro 5700 XT,Magic Mouse o Magic Trackpad,Dos puertos Thunderbolt 3 (USB-C) | Cuatro puertos USB-A,Magic Keyboard,20.3,51.6,8.92,65
MacBook Pro,Blanco solitario,2,1064,64,4000,Cámara FaceTime HD de 720p,Chip M2 de Apple,8 núcleos,Pantalla Retina 13.3",20 horas de bateria,10 núcleos,Magic Keyboard retroiluminado | Touch Bar,Dos puertos Thunderbolt/USB 4,Touch Bar y Touch ID,21.24,1.56,1.4,30.41
AirPods 3ra generacion,Azul black,87,800,Estuche de carga MagSafe,Chip H1,Bluetooth 5.0,Hasta 30 horas de audio con el estuche de carga,No aplica,Sensor de fuerza,Hasta 6 horas de audio con una sola carga,No aplica,Resistentes al agua y al sudor: AirPods y estuche de carga,Audio espacial personalizado con seguimiento dinámico de la cabeza,19.21,30.79,4.28,18.26,21.38,46.4,37.91,54.4
AirPods Pro,Baby blue,43,200,Estuche de carga MagSafe con bocina y ojal para correa,Chip H2,Bluetooth 5.3,Hasta 30 horas de audio con el estuche de carga,Modo ambiente adaptable,Control táctil,Hasta 6 horas de audio con una sola carga,Cancelación activa de ruido,Resistentes al agua y al sudor: AirPods Pro y estuche de carga,Audio espacial personalizado con seguimiento dinámico de la cabeza,24,30.9,5.3,21.8,21.7,45.2,50.8,60.6
AppleWatch Series,Anaranjado lima,78,468,LTE y UMTS,Pantalla Retina OLED LTPO siempre activa,Detección de caidas | choques | llamada SOS,Hasta 18 horas | carga rapida,Frecuencia cardiaca | Temperatura | Control de ciclo,Aluminio | Acero inoxidable,Certificación IP6X de resistencia al polvo | Resistencia al agua 50m
AppleWatch SE,Rojo baby,221,450,LTE y UMTS,Pantalla Retina OLED LTPO,Detección de caidas | choques | llamada SOS,Hasta 18 horas,Frecuencia cardiaca y Control de ciclo,Aluminio,Resistencia al agua 50m
